21:54:13.386596 PPPoE  [ses 0x2b58] IP 100.103.70.200.13227 > 117.96.122.77.domain: 59384+ PTR? c.0.0.0.0.0.0.0.0.0.0.0.0.0.0.0.1.3.2.0.6.0.0.0.0.0.8.a.4.0.4.2.ip6.arpa. (90)
21:54:13.386603 PPPoE  [ses 0x2b58] IP 100.103.70.200.50077 > 87.70.96.34.443: Flags [.], seq 4276229064:4276229065, ack 954998352, win 254, length 1
21:54:14.111111 PPPoE  [ses 0x2b58] IP 192.168.1.10.55165 > 20.189.173.26.443: Flags [.], ack 1, win 254, length 0
21:54:15.222222 PPPoE  [ses 0x2b58] IP 100.103.70.200.55165 > 20.189.173.26.https: Flags [.], ack 1, win 254, length 0
